{
  "schemaVersion": "flying.airport-database.v1",
  "databaseVersion": "2026.08.pilot-seed",
  "airac": {
    "cycleId": "2026-08",
    "effectiveDate": "2026-08-03",
    "source": "Flying project pilot seed",
    "notes": "Synthetic non-operational records for schema validation only; no AIP or VFR manual content is embedded."
  },
  "metadata": {
    "scope": "pilot_airports_only",
    "restrictedSourcePolicy": "no_aip_vfr_content_without_permission",
    "generatedAtUtc": "2026-08-03T00:00:00Z",
    "notes": "Pilot seeds demonstrate the airport master list and runway schema without importing the Czech airport catalogue."
  },
  "masterList": [
    {
      "aerodromeId": "FPPV",
      "name": "Flying Pilot Paved Airport",
      "classification": "active_airport",
      "operationalStatus": "active",
      "recordStatus": "derived",
      "sourceDataStatus": "permitted",
      "airacEffectiveDate": "2026-08-03",
      "provenance": [
        {
          "sourceId": "project-pilot-fixture-2026-08",
          "sourceType": "project_fixture",
          "publisher": "Flying project",
          "sourceDocument": "data_pipeline/seeds/pilot-airport-master-list.json",
          "license": {
            "name": "Project-internal fixture data"
          },
          "permissionStatus": "permitted",
          "retrievedAtUtc": "2026-08-03T00:00:00Z",
          "accuracyM": 25,
          "notes": "Synthetic paved-airport seed record, not suitable for navigation."
        }
      ],
      "validation": {
        "status": "derived",
        "confidence": {
          "overall": 0.45,
          "geometry": 0.4,
          "surface": 0.7,
          "declaredDistances": 0.35
        },
        "manualVerification": {
          "status": "unverified",
          "notes": "Fixture record awaits project review before it can be production validated."
        }
      },
      "notes": "Detailed pilot seed with one paved runway."
    },
    {
      "aerodromeId": "FPGS",
      "name": "Flying Pilot Grass SLZ Field",
      "classification": "slz_field",
      "operationalStatus": "active",
      "recordStatus": "derived",
      "sourceDataStatus": "permitted",
      "airacEffectiveDate": "2026-08-03",
      "provenance": [
        {
          "sourceId": "project-pilot-fixture-2026-08",
          "sourceType": "project_fixture",
          "publisher": "Flying project",
          "sourceDocument": "data_pipeline/seeds/pilot-airport-master-list.json",
          "license": {
            "name": "Project-internal fixture data"
          },
          "permissionStatus": "permitted",
          "retrievedAtUtc": "2026-08-03T00:00:00Z",
          "accuracyM": 30,
          "notes": "Synthetic SLZ-field seed record, not suitable for navigation."
        }
      ],
      "validation": {
        "status": "derived",
        "confidence": {
          "overall": 0.4,
          "geometry": 0.35,
          "surface": 0.65,
          "declaredDistances": 0.3
        },
        "manualVerification": {
          "status": "unverified",
          "notes": "Fixture record awaits project review before it can be production validated."
        }
      },
      "notes": "Detailed pilot seed with one grass runway."
    },
    {
      "aerodromeId": "FPCL",
      "name": "Flying Pilot Closed Checklist Field",
      "classification": "closed_field",
      "operationalStatus": "closed",
      "recordStatus": "validated",
      "sourceDataStatus": "permitted",
      "airacEffectiveDate": "2026-08-03",
      "provenance": [
        {
          "sourceId": "project-closed-field-fixture-2026-08",
          "sourceType": "project_fixture",
          "publisher": "Flying project",
          "sourceDocument": "docs/governance/m0-legal-data-gate.md",
          "license": {
            "name": "Project-internal checklist fixture"
          },
          "permissionStatus": "permitted",
          "retrievedAtUtc": "2026-08-03T00:00:00Z",
          "notes": "Checklist-only fixture proving closed-field classification."
        }
      ],
      "validation": {
        "status": "manually_verified",
        "confidence": {
          "overall": 0.8,
          "geometry": 0,
          "surface": 0,
          "declaredDistances": 0
        },
        "manualVerification": {
          "status": "reviewer_approved",
          "reviewer": "fixture-review",
          "verifiedAtUtc": "2026-08-03T00:00:00Z",
          "notes": "Checklist-only validation state; no runway data are implied."
        }
      },
      "notes": "Master-list only fixture; no aerodrome geometry is packaged."
    },
    {
      "aerodromeId": "FPBP",
      "name": "Flying Pilot Blocked Permission Airport",
      "classification": "active_airport",
      "operationalStatus": "unknown",
      "recordStatus": "blocked_missing_permission",
      "sourceDataStatus": "blocked_missing_permission",
      "airacEffectiveDate": "2026-08-03",
      "provenance": [
        {
          "sourceId": "aip-vfr-permission-gate",
          "sourceType": "restricted_aip_pending_permission",
          "publisher": "Flying governance",
          "sourceDocument": "docs/governance/m0-legal-data-gate.md",
          "permissionStatus": "blocked_missing_permission",
          "retrievedAtUtc": "2026-08-03T00:00:00Z",
          "notes": "Placeholder classifies a record blocked by missing written permission without storing restricted data."
        }
      ],
      "validation": {
        "status": "blocked_missing_permission",
        "confidence": {
          "overall": 0,
          "geometry": 0,
          "surface": 0,
          "declaredDistances": 0
        },
        "manualVerification": {
          "status": "blocked",
          "notes": "Blocked until permission evidence is archived."
        }
      }
    },
    {
      "aerodromeId": "FPBD",
      "name": "Flying Pilot Blocked Source Data SLZ",
      "classification": "slz_field",
      "operationalStatus": "unknown",
      "recordStatus": "blocked_missing_source_data",
      "sourceDataStatus": "blocked_missing_source_data",
      "airacEffectiveDate": "2026-08-03",
      "provenance": [
        {
          "sourceId": "operator-source-request-2026-08",
          "sourceType": "operator_confirmation",
          "publisher": "Flying project",
          "sourceDocument": "docs/governance/m0-legal-data-gate.md",
          "permissionStatus": "blocked_missing_source_data",
          "retrievedAtUtc": "2026-08-03T00:00:00Z",
          "notes": "Placeholder classifies a record blocked by missing operator source data."
        }
      ],
      "validation": {
        "status": "blocked_missing_source_data",
        "confidence": {
          "overall": 0,
          "geometry": 0,
          "surface": 0,
          "declaredDistances": 0
        },
        "manualVerification": {
          "status": "blocked",
          "notes": "Blocked until source data are available."
        }
      }
    }
  ],
  "aerodromes": [
    {
      "id": "FPPV",
      "icaoCode": "",
      "localCode": "FPPV",
      "name": "Flying Pilot Paved Airport",
      "classification": "active_airport",
      "operationalStatus": "active",
      "referencePointWgs84": {
        "latDeg": 49.2,
        "lonDeg": 14.5,
        "elevationM": 430
      },
      "trafficPatternAltitudeFtAgl": 1000,
      "airacEffectiveDate": "2026-08-03",
      "provenance": [
        {
          "sourceId": "project-pilot-fixture-2026-08",
          "sourceType": "project_fixture",
          "publisher": "Flying project",
          "sourceDocument": "data_pipeline/seeds/pilot-airport-master-list.json",
          "license": {
            "name": "Project-internal fixture data"
          },
          "permissionStatus": "permitted",
          "retrievedAtUtc": "2026-08-03T00:00:00Z",
          "accuracyM": 25,
          "notes": "Synthetic paved-airport geometry for schema validation only."
        }
      ],
      "validation": {
        "status": "derived",
        "confidence": {
          "overall": 0.45,
          "geometry": 0.4,
          "surface": 0.7,
          "declaredDistances": 0.35
        },
        "manualVerification": {
          "status": "unverified",
          "notes": "Not production validated."
        }
      },
      "runways": [
        {
          "id": "FPPV-RWY-09-27",
          "designator": "09/27",
          "surface": {
            "surfaceType": "paved",
            "material": "asphalt",
            "condition": "serviceable",
            "loadRating": "fixture-only",
            "notes": "Paved surface type seed."
          },
          "dimensionsM": {
            "length": 850,
            "width": 23
          },
          "lighting": {
            "edgeLights": false,
            "thresholdLights": false,
            "approachLights": false,
            "papi": false,
            "runwayEndIdentifierLights": false,
            "intensity": "none",
            "notes": "No lighting implemented; schema records declared lighting state only."
          },
          "markings": {
            "designator": true,
            "centerline": true,
            "threshold": true,
            "aimingPoint": false,
            "touchdownZone": false,
            "edge": true,
            "notes": "Fixture marking state."
          },
          "slope": {
            "longitudinalPercent": 0.2,
            "transversePercent": 1.2,
            "sourceAccuracyPercent": 0.5,
            "notes": "Synthetic slope value."
          },
          "airacEffectiveDate": "2026-08-03",
          "provenance": [
            {
              "sourceId": "project-pilot-fixture-2026-08",
              "sourceType": "project_fixture",
              "publisher": "Flying project",
              "sourceDocument": "data_pipeline/seeds/pilot-airport-master-list.json",
              "license": {
                "name": "Project-internal fixture data"
              },
              "permissionStatus": "permitted",